Person	Relation	Date	Year of Birth	Gift Plan
Sarah Patterson	Self	February 6	2002	Low-key by preference
Kaitlyn Taylor	Roommate	October 22	2002	Cook her favorites at home
Taylor Reynolds	College friend	March 17	2002	Card mailed in time
Patricia Patterson	Mother	October 18	1973	Drive to Decatur, coordinate with Daniel
Daniel Patterson	Brother	January 9	2004	Card and call
Marcus Calloway	Coworker	February 14	1997	Office cake
Lorraine Patterson	Grandmother	March 6	1949	Visit Columbia if calendar allows
Yvonne Price	Mentor	December 11	1986	Acknowledge in next monthly chat
Denise Monroe	Supervisor	December 3	1981	Card from the team, Sarah coordinates
