label,origin,destination,distance_miles,typical_duration_minutes,preferred_route,note
Home to Amarillo Livestock Auction,"7820 County Road 28, Briscoe TX 79011","100 S Manhattan St, Amarillo TX 79104",96.4,105,TX-152 W to I-40 W,"Going with a gooseneck loaded, Aaron adds 15 minutes. Two-load trips are standard for fall sale day."
Home to Dr. Moyer (Clarendon),"7820 County Road 28, Briscoe TX 79011","Moyer Veterinary Service, Clarendon TX",47.2,58,,
Home to Amarillo Hydraulic and Diesel,"7820 County Road 28, Briscoe TX 79011","Amarillo Hydraulic and Diesel, Amarillo TX",99.1,110,,Will-call pickup option if the FedEx shipment continues to slip.
Home to McLean Feed and Seed,"7820 County Road 28, Briscoe TX 79011","McLean Feed and Seed, McLean TX",18.4,24,,
Home to Tractor Supply Pampa (parts will-call),"7820 County Road 28, Briscoe TX 79011","Tractor Supply Co., Pampa TX",52.7,65,,
Home to Silverton (Briscoe County seat),"7820 County Road 28, Briscoe TX 79011",Silverton TX,68.3,78,,Aaron's town of Briscoe is in Wheeler County. The county named Briscoe is a different place to the south. Aaron drives to Silverton occasionally for ag-extension events.
