channel,title,video_id,duration,views,uploaded,saved_at,description_summary
AgWrench,John Deere 568 Round Baler — Pickup Arm Hydraulic Cylinder Replacement (Step-by-Step),yt-AW-568cyl-RR,22:14,38420,2024-08-19,2026-09-25T20:18:00-05:00,"Full walkthrough on R&R of the 568 pickup-arm hydraulic cylinder. Covers pin removal, cylinder support during the swap, bleeding the line, and torque specs. Tools list at the start."
PanhandleTractorTalk,"JD 568 Baler Repair — Cylinder, Pivot Pin, and What to Inspect While You Are In There",yt-PTT-568cyl-MUST,27:48,21102,2024-03-04,2026-09-26T07:42:00-05:00,"Field repair walkthrough on a 568 hydraulic cylinder swap. Heavy emphasis on what to check while the cylinder is off (pivot pin wear, bushing replacement, hose chafe). Recorded in the Texas Panhandle."
AgWrench,Bleeding a Hydraulic Line After Cylinder R&R — Common Mistakes,yt-AW-bleed-101,9:32,12740,2024-11-22,2026-09-26T07:48:00-05:00,
GrazingPanhandle,"Reading Pasture in a Dry Year — When to Pull Cows Off, When to Hold",yt-GP-drypasture,18:05,7805,2025-07-30,2026-08-12T19:00:00-05:00,
AmarilloLivestockOfficial,Fall Run Preview — What Buyers Are Looking For in October,yt-ALA-fallpreview,11:48,4218,2026-09-29,2026-10-03T22:14:00-05:00,
