date,type,opportunity,subject,to,memo,from
2026-10-04,email_sent,sf-opp-003,Reading Beautification — intake question,marcus.reilly@readingbeautification.org,Asked about jurisdiction rule for the 624 Penn Avenue space.,
2026-10-02,email_received,sf-opp-002,Re: Application Acknowledged — Women in Arts Microgrant 2026,,,grants@berkscommunityfoundation.org
2026-09-22,task_completed,sf-opp-001,Downloaded 2027 application package — PA WBC Aspire,,,
2026-09-12,submission,sf-opp-002,Submitted Women in Arts Microgrant application package,,,
2026-08-30,note,sf-opp-004,,,"Reviewed SBA microloan program. Pricing makes sense only if used to bridge build-out, not for working capital.",
2026-08-12,task_completed,sf-opp-002,Drafted budget narrative for Women in Arts application,,,
2026-07-29,task_completed,sf-opp-002,Drafted artistic statement for Women in Arts application,,,
2026-07-12,note,sf-opp-005,,,Bookmarked Eileen Fisher 2027 program. Joined newsletter.,
