Advertiser,Contact,Spot_Type,Rate_Monthly,Week_Requested,Status,Last_Contact,Notes
Edison Savings Bank,Tom Henderson,60-second,200.00,Ongoing Q4,Renewal pending,2026-09-20,Wants same terms. Awaiting Hari confirmation.
Patel's Jewelers,Meera Patel,30-second,,Oct 13-17 Diwali week,Inquiry received,2026-09-28,Rates not sent yet. Wants 2-3 spots.
Rajan's Curry House,Vikram Jefferson,30-second,100.00,Ongoing,Active,,Family rate - always running
Oak Tree Pharmacy,Dr. Gupta,30-second,150.00,Ongoing,Active,,Renewed through Dec 2026
Garden State Party Rentals,Jim,15-second,75.00,Oct only,Lapsed,2026-08-15,Did not renew for Q4
