Send Date	Campaign	Audience	Recipients	Opens	Open Rate	Clicks	Status
2025-10-09	Fall Note: Stigma and the Family Table	Full List	1764	812	46.0%	131	Sent
2025-10-30	Event: NAMI Florida Panel Recap	Full List	1772	769	43.4%	104	Sent
2025-11-13	On Caregiving and the Holidays	Full List	1781	905	50.8%	166	Sent
2025-12-04	December: A Quiet Reading List	Full List	1788	843	47.2%	142	Sent
2026-01-08	New Year, Same Mission	Full List	1796	934	52.0%	188	Sent
2026-01-29	Grand Rounds Reflections	Engaged 90 Days	1402	742	52.9%	121	Sent
2026-02-12	Cultural Formulation in Practice	Full List	1803	861	47.8%	159	Sent
