Call Date	Contact Person	Call Type	Duration (Minutes)	Call Topics
2025-10-15	Clarice Rawlings	Voice Call	45	Raleigh home updates and health insurance concerns
2025-10-22	Terrell Rawlings	Voice Call	32	Portfolio site Webflow modifications and bug fixes
2025-12-10	Clarice Rawlings	Voice Call	50	Christmas gathering coordinates and travel check
2026-01-15	Terrell Rawlings	Voice Call	28	New year financial tracking software options
2026-02-12	Clarice Rawlings	Voice Call	40	Dental checkup updates and family news
