date	menu	cuisine	guests	kids_helped	notes
2026-01-04	Roast chicken, lemon potatoes, greens	Mediterranean	Family	Yes	Nabil on potatoes
2026-01-11	Lamb and white bean stew, flatbread	Mediterranean	Family plus Rania	Yes	Layla made the flatbread
2026-01-18	Baked branzino, fennel salad	Mediterranean	Family	Yes	Greg critiqued the salt, fairly
2026-01-25	Mushroom risotto, bitter greens	Italian	Family	No	Quiet week
2026-02-01	Shakshuka brunch for dinner	Mediterranean	Family	Yes	Nabil cracked every egg
2026-02-08	Roast vegetables, freekeh, tahini	Mediterranean	Family plus Rania	Yes	Leftovers for Monday
2026-02-15	Slow short ribs, polenta	American	Family	No	Cold night comfort
2026-02-22	Whole roast cauliflower, herbed rice	Mediterranean	Family	Yes	Layla plated it
