Date	Activity	Route	Distance_mi	Duration	Elevation_ft	Notes
2025-09-28	Hike	Radnor Lake Lake Trail	3.1	1:05	190	With Jake, slow pace
2025-10-12	Hike	Percy Warner Mossy Ridge	4.5	1:40	620	Cool morning, brought the Pentax
2025-10-25	Bike	Cumberland River Greenway loop	12.4	1:12	240	Sundown ride, cleared my head
2025-11-16	Hike	Radnor Lake South Cove	2.7	0:55	150	Quiet, fall color peaking
2025-12-07	Bike	Shelby Bottoms Greenway	9.8	0:58	120	Cold but worth it
2026-01-24	Hike	Percy Warner Warner Woods	3.4	1:18	470	Frost on the trail
2026-02-15	Bike	Cumberland River Greenway loop	12.6	1:09	240	First mild day, felt good
