conflict_id,topic,authoritative_source,authoritative_value,decoy_source,decoy_value,winner_rule,resolution_note
CR-001,water_temperature_range_second_stage,"EL-0134 (2025 systematic review, methodological weight A) and EL-0117, EL-0121 (2024 prospective cohorts)","36.8 to 37.5 degrees Celsius",GL-OB-2019-08 clause 4.2,"36.5 to 38.0 degrees Celsius",newest_source_wins,"GL-OB-2019-08 predates the 2024 cohorts and the 2025 review. Guideline citation set aside. Downstream update flagged in RR-EV-003."
CR-002,perineal_trauma_evidence_base,"EL-0072, EL-0088, EL-0110, EL-0119, EL-0126, EL-0139 (2019-2024 studies, methodological weight A and B)","Consistent reduction in third and fourth degree perineal trauma in water birth cohorts",GL-OB-2021-14 clause 6.1,"Cites 2018 review with weaker methodology and smaller sample sizes",most_authoritative_source_wins,"2018 review is superseded by the six 2019-2024 studies. Guideline citation set aside. Downstream update flagged in RR-EV-003."
CR-003,pool_hygiene_cadence_reference,"EL-0130 (2025 European infection control consensus)","Weekly deep clean plus per-use disinfection protocol",Hospital SOP 2019 revision,"Bi-weekly deep clean plus per-use disinfection protocol",newest_source_wins,"2025 consensus is the newer and more authoritative reference. Hospital SOP will be updated to align. Documentation change only, no clinical change."
CR-004,pool_B_seal_replacement_status,Department board entry POOL-B-STATUS refreshed October 27 2026 by biomed lead,"Seal replacement completed, awaiting sign-off",Service desk ticket INC-2026-0982,Awaiting parts,most_authoritative_source_wins,"Biomed lead updates the board directly. Service desk closure lags by two weeks routinely. Process gap flagged in RR-EQ-002."
CR-005,thermometer_THERM-B_last_calibration,Department board KIT-STATUS with inline biomed note September 21 2026,September 21 2026,Service desk INC-2026-1104,June 3 2026,newest_source_wins,"THERM-B recalibrated September 21 2026. Service desk record not updated. Board is authoritative for calibration status."
CR-006,long_horizon_neonatal_infection_beyond_28_days,"EL-0091 (2022, n=380) and EL-0141 (2025, n=310), both below methodological weight A threshold","Neither trend statistically significant. Sample sizes below 400 and no pre-registered protocols.","Absence of publication in this domain","Some readers treat absence of publication as reassurance",held_open_insufficient_evidence,"Evidence is thin. R2 makes no claim on this domain. Held as monitored gap in RR-EV-002. Do not force a verdict."
CR-007,pool_B_fill_time_performance,"Biomed measurement September 15 2026","26 minutes within operational tolerance of 30 minutes","Commissioning document GL-BIOMED-2023-04","22 minutes",newest_source_wins,"2026 measurement supersedes the 2023 commissioning figure. Pool B fill time remains within operational tolerance and is not a blocking dependency for the November 27 2026 decision."
