Date	Lake	Spot	Species	Length_in	Weight_lb	Lure	Kept	With	Notes
2025-10-11	Parker Canyon	East cove	Largemouth bass	14.5	1.8	Green pumpkin senko	No	Ray	Released, slow morning until the wind died
2025-10-11	Parker Canyon	East cove	Largemouth bass	17.0	2.9	Green pumpkin senko	No	Ray	Best fish of the day, fought hard
2025-10-25	Parker Canyon	Dam wall	Rainbow trout	11.0	0.7	PowerBait orange	Yes	Ray	Stocked fish, took it home for the grill
2025-11-01	Parker Canyon	North point	Largemouth bass	12.0	1.1	Crankbait	No	Ray	Cold front, only two bites all morning
2025-11-15	Parker Canyon	East cove	Rainbow trout	13.5	1.2	Spinner silver	Yes	Solo	Ray had Bisbee job, went alone
2025-12-13	Parker Canyon	Dam wall	Largemouth bass	15.5	2.2	Jig black blue	No	Ray	Last trip before it got too cold
2026-01-24	Parker Canyon	North point	Rainbow trout	10.5	0.6	PowerBait rainbow	Yes	Ray	Froze our hands off, two trout each
2026-02-14	Parker Canyon	East cove	Largemouth bass	16.0	2.5	Green pumpkin senko	No	Ray	Warm spell, fish were active by 9
