Supplier	Category	Contact	Phone	Terms	Notes
Keystone Halal Meats	Lamb, beef, chicken (halal)	Bilal Kaya	(610) 555-0173	Net 7	Allentown PA, 90 minute drive, hand select cuts
Restaurant Depot	Bulk dry, produce, supplies	Member desk	(973) 555-0190	Pay on pickup	Account R-44120
Istanbul Market	Turkish specialty, spices, phyllo	Murat	(973) 555-0205	Net 15	Main Street, weekly order
Garden State Linen	Linen and uniforms	Service line	(973) 555-0228	Weekly billing	Both locations
PSE and G	Gas and electric utility	Business line	1-800-436-7734	Monthly	Both locations
Ecolab	Pest control and sanitation	Route tech	(973) 555-0244	Monthly service	Records kept for inspection
Sysco	Backup dry goods	Sales rep	(973) 555-0259	Net 14	Used when Restaurant Depot is short
Paterson Beverage	Soft drinks, ayran, water	Order desk	(973) 555-0277	Net 7	No alcohol products
