"applicant_id","full_name","applied_date","source","years_brewing_experience","prior_breweries","certifications","stage","recruiter_rating_1_5","greg_rating_1_5","larry_rating_1_5","availability_start","hourly_rate_expected","notes"
"BBC-APP-2026-2701","Jordan Mclaren","2026-08-12","Returning candidate (direct outreach by Greg)","6","Bates Brewing (2024 season, 2025 season); Black Mountain Brewing (2022–2023)","Siebel Institute basic brewing certificate, 2023","Offer Recommended","5","5","5","2026-11-02","$22.00","Returning seasonal — previously hired Nov 2024 and Nov 2025. Greg's top recommendation. Knows the brewhouse, knows the SOPs, requires zero ramp-up. Ready for opening day."
"BBC-APP-2026-2702","Naomi Bridgers","2026-08-15","Returning candidate (direct outreach)","4","Bates Brewing (2024 season, 2025 season); Hendersonville Brewing Collective (2023)","BJCP recognized judge, 2023","Offer Recommended","5","5","4","2026-11-02","$22.00","Returning seasonal — previously hired Nov 2024 and Nov 2025. Detail-oriented on sanitation cycles, strong on the bottling line."
"BBC-APP-2026-2703","Maya Chen","2026-08-22","Greenhouse — Brewers Association job board","5","Wicked Weed Brewing (2021–2025); homebrew prior","Cicerone Certified Beer Server, 2022; Siebel Institute, 2024","Offer Recommended","5","4","4","2026-11-02","$22.50","Strong on-site interview. Wants to learn the saison program. Open to staying on past season if a role opens."
"BBC-APP-2026-2704","Patrick Holloway","2026-08-19","Greg (referral, no relation)","3","Catawba Brewing (2023–2026); Highland Brewing intern (2022)","Cicerone Certified Beer Server, 2024","Offer Recommended","4","5","4","2026-11-02","$21.50","Quiet, careful, Greg-style work. Greg vouches. No relation to Greg despite shared surname."
"BBC-APP-2026-2705","Marcus Penley","2026-09-04","Greenhouse — Indeed","4","Smoky Mountain Beverage — currently employed as warehouse supervisor (NOT brewer role); Burial Beer (2022–2023)","None","Offer Recommended","4","3","3","2026-11-02","$22.00","CONFLICT OF INTEREST FLAGGED: Currently employed by Smoky Mountain Beverage, one of our wholesale distributors. Penley says role is warehouse-side not commercial. Greenhouse process moved him to Offer Recommended because his brewhouse skills check out, but the distributor relationship hazard has not been resolved. Needs Larry's call."
"BBC-APP-2026-2706","Ellen Sayers","2026-09-12","Greenhouse — Brewers Association job board","7","Wedge Brewing (2019–2024); New Belgium Asheville (2024–2026)","Siebel Institute advanced certificate, 2022; BJCP recognized judge","Offer Recommended","5","5","4","2026-11-16","$23.00","AVAILABILITY ISSUE: cannot start until November 16 (current employer notice period). Strong candidate on every other axis. Would miss opening week. Greg flagged whether the timing works."
"BBC-APP-2026-2707","Theo Aragon","2026-09-18","Greenhouse — Brewers Association job board","3","Green Man Brewery (2023–2026); homebrew prior","Cicerone Certified Beer Server, 2025","Offer Recommended","4","4","4","2026-11-02","$21.50","Solid on-site interview. Younger, energetic, learns fast. Greg comfortable with him on the mash side."
"BBC-APP-2026-2708","Lucia Romero","2026-09-22","Greenhouse — Brewers Association job board","2","Highland Brewing (2024–2026)","None","On-Site","4","4",,"2026-11-02","$21.50","On-site scheduled for Oct 9. Greg liked the phone screen."
"BBC-APP-2026-2709","Damon Webster","2026-09-15","Greenhouse — LinkedIn","5","Sierra Nevada Mills River (2020–2024); freelance contract brewing (2024–2026)","Siebel Institute basic certificate, 2021","On-Site","4",,,"2026-11-02","$22.00","On-site rescheduled to Oct 11. Strong on the cold side, weaker on the saison fermentation conversation."
"BBC-APP-2026-2710","Kenji Yamada","2026-09-08","Greenhouse — Brewers Association job board","4","Hi-Wire Brewing (2022–2026)","Cicerone Certified Beer Server, 2024","On-Site","4","4",,"2026-11-02","$22.00","On-site completed Oct 2. Awaiting Larry's read."
"BBC-APP-2026-2711","Vincent Caraway","2026-09-20","Greenhouse — referral via Jake Moreland","2","Moreland Brewing, Hendersonville (2024–2026)","None","On-Site","4","4",,"2026-11-02","$21.00","Jake's referral. On-site Oct 8."
"BBC-APP-2026-2712","Hattie Brennan","2026-09-24","Greenhouse — Indeed","1","Burial Beer — assistant role (2025–2026)","None","Phone Screen","3",,,"2026-11-02","$20.50","Phone screen completed Sept 28. Eager. Light on experience."
"BBC-APP-2026-2713","Owen Petrova","2026-09-26","Greenhouse — Brewers Association job board","3","Catawba Brewing (2023–2026)","Cicerone Certified Beer Server, 2024","Phone Screen","4",,,"2026-11-02","$21.00","Phone screen scheduled Oct 6."
"BBC-APP-2026-2714","Aiyana Standingbear","2026-09-21","Greenhouse — Brewers Association job board","4","Asheville Brewing Company (2022–2026)","BJCP recognized judge","Phone Screen","4",,,"2026-11-02","$21.00","Phone screen scheduled Oct 7."
"BBC-APP-2026-2715","Sven Lindqvist","2026-09-28","Greenhouse — LinkedIn","8","Stockholm Brewing Co (Sweden, 2018–2024); Olde Hickory Brewing (2024–2026)","Siebel Institute advanced certificate, 2020","Phone Screen","5",,,"2026-11-02","$24.00","Phone screen scheduled Oct 6. Senior candidate; rate expectation high."
"BBC-APP-2026-2716","Raymond Beckwith","2026-09-29","Greenhouse — Indeed","2","Lookout Brewing (2024–2026)","None","Phone Screen","3",,,"2026-11-02","$20.00","Phone screen scheduled Oct 8."
"BBC-APP-2026-2717","Imani Fairbanks","2026-10-01","Greenhouse — Brewers Association","1","Catawba Brewing assistant (2025–2026)","None","Applied",,,,"2026-11-02","$20.00",""
"BBC-APP-2026-2718","Roland Yates","2026-10-02","Greenhouse — Indeed","3","French Broad Brewing (2023–2026)","Cicerone Beer Server","Applied",,,,"2026-11-02","$21.00",""
"BBC-APP-2026-2719","Beatrix Allard","2026-09-30","Greenhouse — Brewers Association","2","Highland Brewing (2024–2026)","None","Applied",,,,"2026-11-02","$20.00",""
"BBC-APP-2026-2720","Hector Salazar","2026-10-03","Greenhouse — Indeed","4","Wedge Brewing (2021–2026)","None","Applied",,,,"2026-11-02","$21.50",""
"BBC-APP-2026-2721","Mira Dasgupta","2026-10-04","Greenhouse — LinkedIn","5","Sierra Nevada Mills River (2021–2026)","Siebel basic, 2023","Applied",,,,"2026-11-09","$22.00","Note: cannot start opening week; one-week delay from current notice period."
"BBC-APP-2026-2722","Bennett Krasinski","2026-10-04","Greenhouse — Brewers Association","2","Burial Beer (2024–2026)","None","Applied",,,,"2026-11-02","$20.00",""
"BBC-APP-2026-2723","Penelope Forsythe","2026-10-02","Greenhouse — Indeed","1","Hi-Wire Brewing intern (2025–2026)","None","Applied",,,,"2026-11-02","$20.00",""
"BBC-APP-2026-2724","Vikram Anand","2026-10-01","Greenhouse — LinkedIn","6","Wicked Weed Brewing (2019–2025); homebrew (5 years prior)","Cicerone Certified Beer Server, 2023","Applied",,,,"2026-11-02","$22.50",""
"BBC-APP-2026-2725","Augusta Cleary","2026-09-29","Greenhouse — Brewers Association","3","Asheville Brewing Company (2023–2026)","None","Applied",,,,"2026-11-02","$21.00",""
"BBC-APP-2026-2726","Trent Galloway","2026-08-30","Greenhouse — Indeed","0","None — career changer from food service","None","Rejected","2",,,"2026-11-02","$18.00","Rejected at recruiter screen — insufficient brewing exposure for a seasonal slot."
"BBC-APP-2026-2727","Whitney Hargrove","2026-09-02","Greenhouse — Indeed","2","One Stop Beer Shop (2024–2026 — retail role, not production)","None","Rejected","2",,,"2026-11-02","$18.00","Rejected — retail experience not production experience."
"BBC-APP-2026-2728","Cyrus Thompson","2026-09-06","Greenhouse — LinkedIn","10","Multiple — frequent moves","Siebel Institute basic, 2017","Rejected","3","2",,"2026-11-02","$25.00","Rejected post-phone-screen. Tenure pattern concerning (no role held over 14 months in past five years). Rate expectation also above seasonal range."
"BBC-APP-2026-2729","Dahlia Voss","2026-09-10","Greenhouse — Brewers Association","1","Asheville Pizza Brewing (2025–2026)","None","Rejected","2",,,"2026-11-02","$18.00","Rejected at recruiter screen — phone screen no-show twice."
"BBC-APP-2026-2730","Wendell Carpenter","2026-09-14","Greenhouse — Indeed","3","Catawba Brewing (2023–2026)","None","Rejected","3","2",,"2026-11-02","$20.00","Rejected post-phone-screen — Greg flagged inconsistent recall of basic sanitation protocols."
"BBC-APP-2026-2731","Octavia Reinhardt","2026-09-17","Greenhouse — LinkedIn","4","New Belgium Asheville (2022–2026)","Cicerone Certified Beer Server","Rejected","4",,,"2027-01-15","$22.00","Rejected — availability start in mid-January misses two-thirds of season."
"BBC-APP-2026-2732","Beau Tatum","2026-09-19","Greenhouse — Indeed","0","None — recent graduate","UNC-Asheville fermentation studies certificate, 2026","Rejected","2",,,"2026-11-02","$18.00","Rejected at recruiter screen — academic credentials only, no commercial brewing hours."
"BBC-APP-2026-2733","Sergio Almeida","2026-09-25","Greenhouse — Brewers Association","2","Wedge Brewing (2024–2026)","None","Rejected","3","2",,"2026-11-02","$20.00","Rejected post-phone-screen — references did not return after two attempts."
"BBC-APP-2026-2734","Mariah Steinberg","2026-09-27","Greenhouse — LinkedIn","1","Burial Beer (assistant, 2025–2026)","None","Rejected","2",,,"2026-11-02","$18.00","Rejected at recruiter screen — limited fit on overnight fermentation watch availability."
