entry_id,date,description,direction,amount_usd,counterparty,category,note
FP-2026-01,2026-03-04,Berkeley Chess Festival registration deposits collected,IN,3200.00,Eventbrite payout,passthrough,participant fees held on behalf of festival - NOT Dawn income
FP-2026-02,2026-03-11,Venue deposit remitted to Freight & Salvage,OUT,-1800.00,Freight & Salvage,passthrough,festival venue booking - reimbursed from collected fees
FP-2026-03,2026-03-19,Arbiter honorarium remitted,OUT,-600.00,M. Delgado (arbiter),passthrough,festival official - passthrough
FP-2026-04,2026-04-02,Additional registrations collected,IN,1450.00,Eventbrite payout,passthrough,participant fees held on behalf of festival - NOT Dawn income
FP-2026-05,2026-04-15,Prize fund remitted to winners pool,OUT,-1500.00,Festival prize pool,passthrough,festival prizes - passthrough
FP-2026-06,2026-04-22,Printing and boards remitted,OUT,-420.00,Bay Print Co,passthrough,festival materials - passthrough
FP-2026-07,2026-05-06,Sponsor contribution collected,IN,750.00,East Bay Chess Foundation,passthrough,sponsor money held on behalf of festival - NOT Dawn income
FP-2026-08,2026-05-13,Refreshments remitted,OUT,-380.00,Cheese Board Collective,passthrough,festival catering - passthrough
FP-2026-09,2026-05-20,Residual returned to festival account,OUT,-700.00,Berkeley Chess Festival acct,passthrough,net residual swept out - closes passthrough to zero
