Case Number,Date Opened,Category,Status,Lead Detective,Priority,Last Activity,Notes
MC-2026-04182,2026-03-15,Burglary - Commercial,Active,Osborne,Medium,2026-10-08,"Pawn shop on Coal Ave, suspect ID pending"
MC-2026-04297,2026-04-02,Vehicle Theft,Active,Osborne,Medium,2026-10-05,"2019 Ram 1500 from Walmart lot, no cameras on that row"
MC-2026-04510,2026-05-11,Assault - Aggravated,Active,Osborne / Tsosie,High,2026-10-10,"Victim recovering, witness statements conflicting"
MC-2026-04688,2026-06-03,Fraud - Check,Active,Osborne,Low,2026-09-28,"Elderly victim, suspect out of state, coordinating with AZ"
MC-2026-04891,2026-07-14,Burglary - Residential,Active,Osborne,Medium,2026-10-09,"Series of 3, east side, similar MO, pry marks"
MC-2026-05012,2026-08-01,Missing Person,Active,Osborne / Tsosie,High,2026-10-11,"Adult male, 34, last seen Hwy 491, tribal liaison involved"
MC-2026-05198,2026-09-05,Theft - Retail (serial),Active,Osborne,Medium,2026-10-06,"Target and Home Depot, organized group suspected"
MC-2026-05334,2026-10-01,Vandalism - Hate Crime,Active,Osborne,High,2026-10-11,"Graffiti at Navajo-owned business, FBI notified per protocol"
