service	plan	monthly	billing	payment	notes
a video streaming service	individual	13.99	monthly	credit card 3092	truck and reno videos, no ads
a music streaming app	premium	11.99	monthly	credit card 3092	on all day at work
a sports streaming app	annual billed monthly	10.99	monthly	credit card 3092	football, Saints and Alabama
subscriptions budget line	35.00	note	the three run close to budget, trim if it creeps
cloud backup	50gb	0.99	monthly	credit card 3092	phone backups, not counted, tiny
total tracked	37.96	rounded to 35 line plus small overage
