date	course	provider	hours	format	code_update	status
2025-07-12	Grounding and Bonding Fundamentals	AL Trade CE Online	3	online	no	complete
2025-09-08	Residential Service Upgrades	North AL Electrical Institute	2	classroom	no	complete
2025-11-03	Conductor Sizing and Ampacity	AL Trade CE Online	2	online	no	complete
2026-01-19	Arc Fault and GFCI Protection	AL Trade CE Online	1	online	no	complete
8 hours complete to date
2026-10-12	NEC Code Update Course	North AL Electrical Institute	4	classroom	yes	registered
total after code update	12 of 12 required
deadline	2026-12-31
