name	role	contact_method	notes
Hank Cressman	owner	text and call only	old school, fair, never email
Travis Meeks	electrician	text	my usual two man partner
Donna Cressman	office invoicing	email or office	handles billing, Hanks wife
Leah Pierce	journeyman	text and call	me
week	monday	tuesday	wednesday	thursday	friday	saturday
schedule	new construction	remodel panel job	office light commercial	remodel	service calls	off unless busy season
hours	7:00 to 3:30	7:00 to 3:30	7:00 to 3:30	7:00 to 3:30	7:00 to 3:30	occasional OT
note	work comms with Hank are text and phone on my personal line, no work email
